RESET MASTER;
# Connection default
CREATE TABLE t1 (a INT, b VARCHAR(100), PRIMARY KEY (a,b)) ENGINE=innodb;
SHOW MASTER STATUS;
File	Position	Binlog_Do_DB	Binlog_Ignore_DB	Executed_Gtid_Set
binlog.000001	401			
SHOW STATUS LIKE 'binlog_snapshot_%';
Variable_name	Value
Binlog_snapshot_file	binlog.000001
Binlog_snapshot_position	401
Binlog_snapshot_gtid_executed	not-in-consistent-snapshot
BEGIN;
INSERT INTO t1 VALUES (0, "");
# Connection con1
BEGIN;
INSERT INTO t1 VALUES (1, "");
# Connection con2
CREATE TABLE t2 (a INT PRIMARY KEY) ENGINE=myisam;
BEGIN;
INSERT INTO t1 VALUES (2, "first");
INSERT INTO t2 VALUES (2);
INSERT INTO t1 VALUES (2, "second");
# Connection default
COMMIT;
SET TRANSACTION ISOLATION LEVEL REPEATABLE READ;
START TRANSACTION WITH CONSISTENT SNAPSHOT;
# Connection con3
BEGIN;
INSERT INTO t1 VALUES (3, "");
INSERT INTO t2 VALUES (3);
# Connection con4
BEGIN;
INSERT INTO t1 VALUES (4, "");
COMMIT;
# Connection default
SELECT * FROM t1 ORDER BY a,b;
a	b
0	
SHOW STATUS LIKE 'binlog_snapshot_%';
Variable_name	Value
Binlog_snapshot_file	binlog.000001
Binlog_snapshot_position	1222
Binlog_snapshot_gtid_executed	
SHOW MASTER STATUS;
File	Position	Binlog_Do_DB	Binlog_Ignore_DB	Executed_Gtid_Set
binlog.000001	1838			
SELECT * FROM t2 ORDER BY a;
a
2
3
# Connection con1
COMMIT;
# Connection con2
COMMIT;
# Connection con3
COMMIT;
FLUSH LOGS;
# Connection default
SELECT * FROM t1 ORDER BY a,b;
a	b
0	
SHOW STATUS LIKE 'binlog_snapshot_%';
Variable_name	Value
Binlog_snapshot_file	binlog.000001
Binlog_snapshot_position	1222
Binlog_snapshot_gtid_executed	
SHOW MASTER STATUS;
File	Position	Binlog_Do_DB	Binlog_Ignore_DB	Executed_Gtid_Set
binlog.000002	164			
COMMIT;
SHOW STATUS LIKE 'binlog_snapshot_%';
Variable_name	Value
Binlog_snapshot_file	binlog.000002
Binlog_snapshot_position	164
Binlog_snapshot_gtid_executed	not-in-consistent-snapshot
SHOW MASTER STATUS;
File	Position	Binlog_Do_DB	Binlog_Ignore_DB	Executed_Gtid_Set
binlog.000002	164			
# Test START TRANSACTION WITH CONSISTENT SNAPSHOT FROM SESSION
DELETE FROM t1;
START TRANSACTION WITH CONSISTENT SNAPSHOT;
SHOW STATUS LIKE 'binlog_snapshot_%';
Variable_name	Value
Binlog_snapshot_file	binlog.000002
Binlog_snapshot_position	447
Binlog_snapshot_gtid_executed	
SHOW MASTER STATUS;
File	Position	Binlog_Do_DB	Binlog_Ignore_DB	Executed_Gtid_Set
binlog.000002	447			
INSERT INTO t1 VALUES (1, "first");
SELECT * FROM t1;
a	b
1	first
# Connection con3
INSERT INTO t1 VALUES (3, "third");
SELECT * FROM t1;
a	b
3	third
SHOW STATUS LIKE 'binlog_snapshot_%';
Variable_name	Value
Binlog_snapshot_file	binlog.000002
Binlog_snapshot_position	750
Binlog_snapshot_gtid_executed	not-in-consistent-snapshot
SHOW MASTER STATUS;
File	Position	Binlog_Do_DB	Binlog_Ignore_DB	Executed_Gtid_Set
binlog.000002	750			
# Connection con2
SELECT * FROM t1;
a	b
3	third
SHOW STATUS LIKE 'binlog_snapshot_%';
Variable_name	Value
Binlog_snapshot_file	binlog.000002
Binlog_snapshot_position	750
Binlog_snapshot_gtid_executed	not-in-consistent-snapshot
SHOW MASTER STATUS;
File	Position	Binlog_Do_DB	Binlog_Ignore_DB	Executed_Gtid_Set
binlog.000002	750			
START TRANSACTION WITH CONSISTENT SNAPSHOT FROM SESSION $donor_id;
SELECT * FROM t1;
a	b
1	first
SHOW STATUS LIKE 'binlog_snapshot_%';
Variable_name	Value
Binlog_snapshot_file	binlog.000002
Binlog_snapshot_position	447
Binlog_snapshot_gtid_executed	
SHOW MASTER STATUS;
File	Position	Binlog_Do_DB	Binlog_Ignore_DB	Executed_Gtid_Set
binlog.000002	750			
# Connection con3
FLUSH LOGS;
SHOW STATUS LIKE 'binlog_snapshot_%';
Variable_name	Value
Binlog_snapshot_file	binlog.000003
Binlog_snapshot_position	164
Binlog_snapshot_gtid_executed	not-in-consistent-snapshot
SHOW MASTER STATUS;
File	Position	Binlog_Do_DB	Binlog_Ignore_DB	Executed_Gtid_Set
binlog.000003	164			
# Connection con2
SHOW STATUS LIKE 'binlog_snapshot_%';
Variable_name	Value
Binlog_snapshot_file	binlog.000002
Binlog_snapshot_position	447
Binlog_snapshot_gtid_executed	
SHOW MASTER STATUS;
File	Position	Binlog_Do_DB	Binlog_Ignore_DB	Executed_Gtid_Set
binlog.000003	164			
COMMIT;
# Connection default
SHOW STATUS LIKE 'binlog_snapshot_%';
Variable_name	Value
Binlog_snapshot_file	binlog.000002
Binlog_snapshot_position	447
Binlog_snapshot_gtid_executed	
SHOW MASTER STATUS;
File	Position	Binlog_Do_DB	Binlog_Ignore_DB	Executed_Gtid_Set
binlog.000003	164			
COMMIT;
SHOW BINLOG EVENTS;
Log_name	Pos	Event_type	Server_id	End_log_pos	Info
binlog.000001	4	Format_desc	1	125	Server ver: #, Binlog ver: #
binlog.000001	125	Previous_gtids	1	164	
binlog.000001	164	Anonymous_Gtid	1	241	SET @@SESSION.GTID_NEXT= 'ANONYMOUS'
binlog.000001	241	Query	1	401	use `test`; CREATE TABLE t1 (a INT, b VARCHAR(100), PRIMARY KEY (a,b)) ENGINE=innodb /* XID */
binlog.000001	401	Anonymous_Gtid	1	478	SET @@SESSION.GTID_NEXT= 'ANONYMOUS'
binlog.000001	478	Query	1	606	use `test`; CREATE TABLE t2 (a INT PRIMARY KEY) ENGINE=myisam
binlog.000001	606	Anonymous_Gtid	1	685	SET @@SESSION.GTID_NEXT= 'ANONYMOUS'
binlog.000001	685	Query	1	760	BEGIN
binlog.000001	760	Table_map	1	808	table_id: # (test.t2)
binlog.000001	808	Write_rows	1	848	table_id: # flags: STMT_END_F
binlog.000001	848	Query	1	924	COMMIT
binlog.000001	924	Anonymous_Gtid	1	1003	SET @@SESSION.GTID_NEXT= 'ANONYMOUS'
binlog.000001	1003	Query	1	1085	BEGIN
binlog.000001	1085	Query	1	1191	use `test`; INSERT INTO t1 VALUES (0, "")
binlog.000001	1191	Xid	1	1222	COMMIT /* XID */
binlog.000001	1222	Anonymous_Gtid	1	1301	SET @@SESSION.GTID_NEXT= 'ANONYMOUS'
binlog.000001	1301	Query	1	1376	BEGIN
binlog.000001	1376	Table_map	1	1424	table_id: # (test.t2)
binlog.000001	1424	Write_rows	1	1464	table_id: # flags: STMT_END_F
binlog.000001	1464	Query	1	1540	COMMIT
binlog.000001	1540	Anonymous_Gtid	1	1619	SET @@SESSION.GTID_NEXT= 'ANONYMOUS'
binlog.000001	1619	Query	1	1701	BEGIN
binlog.000001	1701	Query	1	1807	use `test`; INSERT INTO t1 VALUES (4, "")
binlog.000001	1807	Xid	1	1838	COMMIT /* XID */
binlog.000001	1838	Anonymous_Gtid	1	1917	SET @@SESSION.GTID_NEXT= 'ANONYMOUS'
binlog.000001	1917	Query	1	1999	BEGIN
binlog.000001	1999	Query	1	2105	use `test`; INSERT INTO t1 VALUES (1, "")
binlog.000001	2105	Xid	1	2136	COMMIT /* XID */
binlog.000001	2136	Anonymous_Gtid	1	2215	SET @@SESSION.GTID_NEXT= 'ANONYMOUS'
binlog.000001	2215	Query	1	2297	BEGIN
binlog.000001	2297	Query	1	2408	use `test`; INSERT INTO t1 VALUES (2, "first")
binlog.000001	2408	Query	1	2520	use `test`; INSERT INTO t1 VALUES (2, "second")
binlog.000001	2520	Xid	1	2551	COMMIT /* XID */
binlog.000001	2551	Anonymous_Gtid	1	2630	SET @@SESSION.GTID_NEXT= 'ANONYMOUS'
binlog.000001	2630	Query	1	2712	BEGIN
binlog.000001	2712	Query	1	2818	use `test`; INSERT INTO t1 VALUES (3, "")
binlog.000001	2818	Xid	1	2849	COMMIT /* XID */
binlog.000001	2849	Rotate	1	2893	binlog.000002;pos=4
DROP TABLE t1,t2;
