CALL mtr.add_suppression("Statement is unsafe because it accesses a non-transactional table after");
RESET MASTER;
# Connection default
CREATE TABLE t1 (a INT, b VARCHAR(100), PRIMARY KEY (a,b)) ENGINE=innodb;
SHOW MASTER STATUS;
File	Position	Binlog_Do_DB	Binlog_Ignore_DB	Executed_Gtid_Set
binlog.000001	409			
SHOW STATUS LIKE 'binlog_snapshot_%';
Variable_name	Value
Binlog_snapshot_file	binlog.000001
Binlog_snapshot_position	409
Binlog_snapshot_gtid_executed	not-in-consistent-snapshot
BEGIN;
INSERT INTO t1 VALUES (0, "");
# Connection con1
BEGIN;
INSERT INTO t1 VALUES (1, "");
# Connection con2
CREATE TABLE t2 (a INT PRIMARY KEY) ENGINE=myisam;
BEGIN;
INSERT INTO t1 VALUES (2, "first");
INSERT INTO t2 VALUES (2);
Warnings:
Note	1592	Unsafe statement written to the binary log using statement format since BINLOG_FORMAT = STATEMENT. Statement is unsafe because it accesses a non-transactional table after accessing a transactional table within the same transaction.
INSERT INTO t1 VALUES (2, "second");
# Connection default
COMMIT;
SET TRANSACTION ISOLATION LEVEL REPEATABLE READ;
START TRANSACTION WITH CONSISTENT SNAPSHOT;
# Connection con3
BEGIN;
INSERT INTO t1 VALUES (3, "");
INSERT INTO t2 VALUES (3);
Warnings:
Note	1592	Unsafe statement written to the binary log using statement format since BINLOG_FORMAT = STATEMENT. Statement is unsafe because it accesses a non-transactional table after accessing a transactional table within the same transaction.
# Connection con4
BEGIN;
INSERT INTO t1 VALUES (4, "");
COMMIT;
# Connection default
SELECT * FROM t1 ORDER BY a,b;
a	b
0	
SHOW STATUS LIKE 'binlog_snapshot_%';
Variable_name	Value
Binlog_snapshot_file	binlog.000001
Binlog_snapshot_position	912
Binlog_snapshot_gtid_executed	
SHOW MASTER STATUS;
File	Position	Binlog_Do_DB	Binlog_Ignore_DB	Executed_Gtid_Set
binlog.000001	1210			
SELECT * FROM t2 ORDER BY a;
a
2
3
# Connection con1
COMMIT;
# Connection con2
COMMIT;
# Connection con3
COMMIT;
FLUSH LOGS;
# Connection default
SELECT * FROM t1 ORDER BY a,b;
a	b
0	
SHOW STATUS LIKE 'binlog_snapshot_%';
Variable_name	Value
Binlog_snapshot_file	binlog.000001
Binlog_snapshot_position	912
Binlog_snapshot_gtid_executed	
SHOW MASTER STATUS;
File	Position	Binlog_Do_DB	Binlog_Ignore_DB	Executed_Gtid_Set
binlog.000002	172			
COMMIT;
SHOW STATUS LIKE 'binlog_snapshot_%';
Variable_name	Value
Binlog_snapshot_file	binlog.000002
Binlog_snapshot_position	172
Binlog_snapshot_gtid_executed	not-in-consistent-snapshot
SHOW MASTER STATUS;
File	Position	Binlog_Do_DB	Binlog_Ignore_DB	Executed_Gtid_Set
binlog.000002	172			
# Test START TRANSACTION WITH CONSISTENT SNAPSHOT FROM SESSION
DELETE FROM t1;
START TRANSACTION WITH CONSISTENT SNAPSHOT;
SHOW STATUS LIKE 'binlog_snapshot_%';
Variable_name	Value
Binlog_snapshot_file	binlog.000002
Binlog_snapshot_position	455
Binlog_snapshot_gtid_executed	
SHOW MASTER STATUS;
File	Position	Binlog_Do_DB	Binlog_Ignore_DB	Executed_Gtid_Set
binlog.000002	455			
INSERT INTO t1 VALUES (1, "first");
SELECT * FROM t1;
a	b
1	first
# Connection con3
INSERT INTO t1 VALUES (3, "third");
SELECT * FROM t1;
a	b
3	third
SHOW STATUS LIKE 'binlog_snapshot_%';
Variable_name	Value
Binlog_snapshot_file	binlog.000002
Binlog_snapshot_position	758
Binlog_snapshot_gtid_executed	not-in-consistent-snapshot
SHOW MASTER STATUS;
File	Position	Binlog_Do_DB	Binlog_Ignore_DB	Executed_Gtid_Set
binlog.000002	758			
# Connection con2
SELECT * FROM t1;
a	b
3	third
SHOW STATUS LIKE 'binlog_snapshot_%';
Variable_name	Value
Binlog_snapshot_file	binlog.000002
Binlog_snapshot_position	758
Binlog_snapshot_gtid_executed	not-in-consistent-snapshot
SHOW MASTER STATUS;
File	Position	Binlog_Do_DB	Binlog_Ignore_DB	Executed_Gtid_Set
binlog.000002	758			
START TRANSACTION WITH CONSISTENT SNAPSHOT FROM SESSION $donor_id;
SELECT * FROM t1;
a	b
1	first
SHOW STATUS LIKE 'binlog_snapshot_%';
Variable_name	Value
Binlog_snapshot_file	binlog.000002
Binlog_snapshot_position	455
Binlog_snapshot_gtid_executed	
SHOW MASTER STATUS;
File	Position	Binlog_Do_DB	Binlog_Ignore_DB	Executed_Gtid_Set
binlog.000002	758			
# Connection con3
FLUSH LOGS;
SHOW STATUS LIKE 'binlog_snapshot_%';
Variable_name	Value
Binlog_snapshot_file	binlog.000003
Binlog_snapshot_position	172
Binlog_snapshot_gtid_executed	not-in-consistent-snapshot
SHOW MASTER STATUS;
File	Position	Binlog_Do_DB	Binlog_Ignore_DB	Executed_Gtid_Set
binlog.000003	172			
# Connection con2
SHOW STATUS LIKE 'binlog_snapshot_%';
Variable_name	Value
Binlog_snapshot_file	binlog.000002
Binlog_snapshot_position	455
Binlog_snapshot_gtid_executed	
SHOW MASTER STATUS;
File	Position	Binlog_Do_DB	Binlog_Ignore_DB	Executed_Gtid_Set
binlog.000003	172			
COMMIT;
# Connection default
SHOW STATUS LIKE 'binlog_snapshot_%';
Variable_name	Value
Binlog_snapshot_file	binlog.000002
Binlog_snapshot_position	455
Binlog_snapshot_gtid_executed	
SHOW MASTER STATUS;
File	Position	Binlog_Do_DB	Binlog_Ignore_DB	Executed_Gtid_Set
binlog.000003	172			
COMMIT;
SHOW BINLOG EVENTS;
Log_name	Pos	Event_type	Server_id	End_log_pos	Info
binlog.000001	4	Format_desc	1	125	Server ver: #, Binlog ver: #
binlog.000001	125	Previous_gtids	1	172		XA-PREPARED: xa1
binlog.000001	172	Anonymous_Gtid	1	249	SET @@SESSION.GTID_NEXT= 'ANONYMOUS'
binlog.000001	249	Query	1	409	use `test`; CREATE TABLE t1 (a INT, b VARCHAR(100), PRIMARY KEY (a,b)) ENGINE=innodb /* XID */
binlog.000001	409	Anonymous_Gtid	1	486	SET @@SESSION.GTID_NEXT= 'ANONYMOUS'
binlog.000001	486	Query	1	614	use `test`; CREATE TABLE t2 (a INT PRIMARY KEY) ENGINE=myisam
binlog.000001	614	Anonymous_Gtid	1	693	SET @@SESSION.GTID_NEXT= 'ANONYMOUS'
binlog.000001	693	Query	1	775	BEGIN
binlog.000001	775	Query	1	881	use `test`; INSERT INTO t1 VALUES (0, "")
binlog.000001	881	Xid	1	912	COMMIT /* XID */
binlog.000001	912	Anonymous_Gtid	1	991	SET @@SESSION.GTID_NEXT= 'ANONYMOUS'
binlog.000001	991	Query	1	1073	BEGIN
binlog.000001	1073	Query	1	1179	use `test`; INSERT INTO t1 VALUES (4, "")
binlog.000001	1179	Xid	1	1210	COMMIT /* XID */
binlog.000001	1210	Anonymous_Gtid	1	1289	SET @@SESSION.GTID_NEXT= 'ANONYMOUS'
binlog.000001	1289	Query	1	1371	BEGIN
binlog.000001	1371	Query	1	1477	use `test`; INSERT INTO t1 VALUES (1, "")
binlog.000001	1477	Xid	1	1508	COMMIT /* XID */
binlog.000001	1508	Anonymous_Gtid	1	1587	SET @@SESSION.GTID_NEXT= 'ANONYMOUS'
binlog.000001	1587	Query	1	1669	BEGIN
binlog.000001	1669	Query	1	1780	use `test`; INSERT INTO t1 VALUES (2, "first")
binlog.000001	1780	Query	1	1882	use `test`; INSERT INTO t2 VALUES (2)
binlog.000001	1882	Query	1	1994	use `test`; INSERT INTO t1 VALUES (2, "second")
binlog.000001	1994	Xid	1	2025	COMMIT /* XID */
binlog.000001	2025	Anonymous_Gtid	1	2104	SET @@SESSION.GTID_NEXT= 'ANONYMOUS'
binlog.000001	2104	Query	1	2186	BEGIN
binlog.000001	2186	Query	1	2292	use `test`; INSERT INTO t1 VALUES (3, "")
binlog.000001	2292	Query	1	2394	use `test`; INSERT INTO t2 VALUES (3)
binlog.000001	2394	Xid	1	2425	COMMIT /* XID */
binlog.000001	2425	Rotate	1	2469	binlog.000002;pos=4
DROP TABLE t1,t2;
