RESET MASTER;
# Connection default
CREATE TABLE t1 (a INT, b VARCHAR(100), PRIMARY KEY (a,b)) ENGINE=innodb;
SHOW MASTER STATUS;
File	Position	Binlog_Do_DB	Binlog_Ignore_DB	Executed_Gtid_Set
binlog.000001	401			
SHOW STATUS LIKE 'binlog_snapshot_%';
Variable_name	Value
Binlog_snapshot_file	binlog.000001
Binlog_snapshot_position	401
Binlog_snapshot_gtid_executed	not-in-consistent-snapshot
BEGIN;
INSERT INTO t1 VALUES (0, "");
# Connection con1
BEGIN;
INSERT INTO t1 VALUES (1, "");
# Connection con2
CREATE TABLE t2 (a INT PRIMARY KEY) ENGINE=myisam;
BEGIN;
INSERT INTO t1 VALUES (2, "first");
INSERT INTO t2 VALUES (2);
INSERT INTO t1 VALUES (2, "second");
# Connection default
COMMIT;
SET TRANSACTION ISOLATION LEVEL REPEATABLE READ;
START TRANSACTION WITH CONSISTENT SNAPSHOT;
# Connection con3
BEGIN;
INSERT INTO t1 VALUES (3, "");
INSERT INTO t2 VALUES (3);
# Connection con4
BEGIN;
INSERT INTO t1 VALUES (4, "");
COMMIT;
# Connection default
SELECT * FROM t1 ORDER BY a,b;
a	b
0	
SHOW STATUS LIKE 'binlog_snapshot_%';
Variable_name	Value
Binlog_snapshot_file	binlog.000001
Binlog_snapshot_position	1207
Binlog_snapshot_gtid_executed	
SHOW MASTER STATUS;
File	Position	Binlog_Do_DB	Binlog_Ignore_DB	Executed_Gtid_Set
binlog.000001	1808			
SELECT * FROM t2 ORDER BY a;
a
2
3
# Connection con1
COMMIT;
# Connection con2
COMMIT;
# Connection con3
COMMIT;
FLUSH LOGS;
# Connection default
SELECT * FROM t1 ORDER BY a,b;
a	b
0	
SHOW STATUS LIKE 'binlog_snapshot_%';
Variable_name	Value
Binlog_snapshot_file	binlog.000001
Binlog_snapshot_position	1207
Binlog_snapshot_gtid_executed	
SHOW MASTER STATUS;
File	Position	Binlog_Do_DB	Binlog_Ignore_DB	Executed_Gtid_Set
binlog.000002	164			
COMMIT;
SHOW STATUS LIKE 'binlog_snapshot_%';
Variable_name	Value
Binlog_snapshot_file	binlog.000002
Binlog_snapshot_position	164
Binlog_snapshot_gtid_executed	not-in-consistent-snapshot
SHOW MASTER STATUS;
File	Position	Binlog_Do_DB	Binlog_Ignore_DB	Executed_Gtid_Set
binlog.000002	164			
# Test START TRANSACTION WITH CONSISTENT SNAPSHOT FROM SESSION
DELETE FROM t1;
START TRANSACTION WITH CONSISTENT SNAPSHOT;
SHOW STATUS LIKE 'binlog_snapshot_%';
Variable_name	Value
Binlog_snapshot_file	binlog.000002
Binlog_snapshot_position	493
Binlog_snapshot_gtid_executed	
SHOW MASTER STATUS;
File	Position	Binlog_Do_DB	Binlog_Ignore_DB	Executed_Gtid_Set
binlog.000002	493			
INSERT INTO t1 VALUES (1, "first");
SELECT * FROM t1;
a	b
1	first
# Connection con3
INSERT INTO t1 VALUES (3, "third");
SELECT * FROM t1;
a	b
3	third
SHOW STATUS LIKE 'binlog_snapshot_%';
Variable_name	Value
Binlog_snapshot_file	binlog.000002
Binlog_snapshot_position	781
Binlog_snapshot_gtid_executed	not-in-consistent-snapshot
SHOW MASTER STATUS;
File	Position	Binlog_Do_DB	Binlog_Ignore_DB	Executed_Gtid_Set
binlog.000002	781			
# Connection con2
SELECT * FROM t1;
a	b
3	third
SHOW STATUS LIKE 'binlog_snapshot_%';
Variable_name	Value
Binlog_snapshot_file	binlog.000002
Binlog_snapshot_position	781
Binlog_snapshot_gtid_executed	not-in-consistent-snapshot
SHOW MASTER STATUS;
File	Position	Binlog_Do_DB	Binlog_Ignore_DB	Executed_Gtid_Set
binlog.000002	781			
START TRANSACTION WITH CONSISTENT SNAPSHOT FROM SESSION $donor_id;
SELECT * FROM t1;
a	b
1	first
SHOW STATUS LIKE 'binlog_snapshot_%';
Variable_name	Value
Binlog_snapshot_file	binlog.000002
Binlog_snapshot_position	493
Binlog_snapshot_gtid_executed	
SHOW MASTER STATUS;
File	Position	Binlog_Do_DB	Binlog_Ignore_DB	Executed_Gtid_Set
binlog.000002	781			
# Connection con3
FLUSH LOGS;
SHOW STATUS LIKE 'binlog_snapshot_%';
Variable_name	Value
Binlog_snapshot_file	binlog.000003
Binlog_snapshot_position	164
Binlog_snapshot_gtid_executed	not-in-consistent-snapshot
SHOW MASTER STATUS;
File	Position	Binlog_Do_DB	Binlog_Ignore_DB	Executed_Gtid_Set
binlog.000003	164			
# Connection con2
SHOW STATUS LIKE 'binlog_snapshot_%';
Variable_name	Value
Binlog_snapshot_file	binlog.000002
Binlog_snapshot_position	493
Binlog_snapshot_gtid_executed	
SHOW MASTER STATUS;
File	Position	Binlog_Do_DB	Binlog_Ignore_DB	Executed_Gtid_Set
binlog.000003	164			
COMMIT;
# Connection default
SHOW STATUS LIKE 'binlog_snapshot_%';
Variable_name	Value
Binlog_snapshot_file	binlog.000002
Binlog_snapshot_position	493
Binlog_snapshot_gtid_executed	
SHOW MASTER STATUS;
File	Position	Binlog_Do_DB	Binlog_Ignore_DB	Executed_Gtid_Set
binlog.000003	164			
COMMIT;
SHOW BINLOG EVENTS;
Log_name	Pos	Event_type	Server_id	End_log_pos	Info
binlog.000001	4	Format_desc	1	125	Server ver: #, Binlog ver: #
binlog.000001	125	Previous_gtids	1	164	
binlog.000001	164	Anonymous_Gtid	1	241	SET @@SESSION.GTID_NEXT= 'ANONYMOUS'
binlog.000001	241	Query	1	401	use `test`; CREATE TABLE t1 (a INT, b VARCHAR(100), PRIMARY KEY (a,b)) ENGINE=innodb /* XID */
binlog.000001	401	Anonymous_Gtid	1	478	SET @@SESSION.GTID_NEXT= 'ANONYMOUS'
binlog.000001	478	Query	1	606	use `test`; CREATE TABLE t2 (a INT PRIMARY KEY) ENGINE=myisam
binlog.000001	606	Anonymous_Gtid	1	685	SET @@SESSION.GTID_NEXT= 'ANONYMOUS'
binlog.000001	685	Query	1	760	BEGIN
binlog.000001	760	Table_map	1	808	table_id: # (test.t2)
binlog.000001	808	Write_rows	1	848	table_id: # flags: STMT_END_F
binlog.000001	848	Query	1	924	COMMIT
binlog.000001	924	Anonymous_Gtid	1	1003	SET @@SESSION.GTID_NEXT= 'ANONYMOUS'
binlog.000001	1003	Query	1	1078	BEGIN
binlog.000001	1078	Table_map	1	1134	table_id: # (test.t1)
binlog.000001	1134	Write_rows	1	1176	table_id: # flags: STMT_END_F
binlog.000001	1176	Xid	1	1207	COMMIT /* XID */
binlog.000001	1207	Anonymous_Gtid	1	1286	SET @@SESSION.GTID_NEXT= 'ANONYMOUS'
binlog.000001	1286	Query	1	1361	BEGIN
binlog.000001	1361	Table_map	1	1409	table_id: # (test.t2)
binlog.000001	1409	Write_rows	1	1449	table_id: # flags: STMT_END_F
binlog.000001	1449	Query	1	1525	COMMIT
binlog.000001	1525	Anonymous_Gtid	1	1604	SET @@SESSION.GTID_NEXT= 'ANONYMOUS'
binlog.000001	1604	Query	1	1679	BEGIN
binlog.000001	1679	Table_map	1	1735	table_id: # (test.t1)
binlog.000001	1735	Write_rows	1	1777	table_id: # flags: STMT_END_F
binlog.000001	1777	Xid	1	1808	COMMIT /* XID */
binlog.000001	1808	Anonymous_Gtid	1	1887	SET @@SESSION.GTID_NEXT= 'ANONYMOUS'
binlog.000001	1887	Query	1	1962	BEGIN
binlog.000001	1962	Table_map	1	2018	table_id: # (test.t1)
binlog.000001	2018	Write_rows	1	2060	table_id: # flags: STMT_END_F
binlog.000001	2060	Xid	1	2091	COMMIT /* XID */
binlog.000001	2091	Anonymous_Gtid	1	2170	SET @@SESSION.GTID_NEXT= 'ANONYMOUS'
binlog.000001	2170	Query	1	2245	BEGIN
binlog.000001	2245	Table_map	1	2301	table_id: # (test.t1)
binlog.000001	2301	Write_rows	1	2348	table_id: # flags: STMT_END_F
binlog.000001	2348	Table_map	1	2404	table_id: # (test.t1)
binlog.000001	2404	Write_rows	1	2452	table_id: # flags: STMT_END_F
binlog.000001	2452	Xid	1	2483	COMMIT /* XID */
binlog.000001	2483	Anonymous_Gtid	1	2562	SET @@SESSION.GTID_NEXT= 'ANONYMOUS'
binlog.000001	2562	Query	1	2637	BEGIN
binlog.000001	2637	Table_map	1	2693	table_id: # (test.t1)
binlog.000001	2693	Write_rows	1	2735	table_id: # flags: STMT_END_F
binlog.000001	2735	Xid	1	2766	COMMIT /* XID */
binlog.000001	2766	Rotate	1	2810	binlog.000002;pos=4
DROP TABLE t1,t2;
